publication_id,publication_alias,publication_type,publication_user_id,publication_entry_date,PMID,DOI,PDF,title,abstract,publication_date,journal_abbreviation,journal,keywords,firstauthor_lastname,firstauthor_firstname,update_date
107,pub107,case_series,3,2021-11-01,23159250,10.1016/j.ajhg.2012.10.007,sanna-cherchi2012.pdf,Copy-number disorders are a common cause of congenital kidney malformations.,"We examined the burden of large, rare, copy-number variants (CNVs) in 192 individuals with renal hypodysplasia (RHD) and replicated findings in 330 RHD cases from two independent cohorts. CNV distribution was significantly skewed toward larger gene-disrupting events in RHD cases compared to 4,733 ethnicity-matched controls (p = 4.8 .. 10(-11)). This excess was attributable to known and novel (i.e., not present in any database or in the literature) genomic disorders. All together, 55/522 (10.5%) RHD cases harbored 34 distinct known genomic disorders, which were detected in only 0.2% of 13,839 population controls (p = 1.2 .. 10(-58)). Another 32 (6.1%) RHD cases harbored large gene-disrupting CNVs that were absent from or extremely rare in the 13,839 population controls, identifying 38 potential novel or rare genomic disorders for this trait. Deletions at the HNF1B locus and the DiGeorge/velocardiofacial locus were most frequent. However, the majority of disorders were detected in a sing",2013-02-14,Am J Hum Genet,American journal of human genetics,Case-Control Studies; Chromosome Aberrations; DNA Copy Number Variations; Genetic Association Studies; Genotype; Humans; Kidney Diseases; Molecular Sequence Annotation,Sanna-Cherchi,Simone,2021-09-15
108,pub108,case_series,3,2021-11-01,17924346,10.1086/522591,mefford2007.pdf,"Recurrent reciprocal genomic rearrangements of 17q12 are associated with renal disease, diabetes, and epilepsy.","Most studies of genomic disorders have focused on patients with cognitive disability and/or peripheral nervous system defects. In an effort to broaden the phenotypic spectrum of this disease model, we assessed 155 autopsy samples from fetuses with well-defined developmental pathologies in regions predisposed to recurrent rearrangement, by array-based comparative genomic hybridization. We found that 6% of fetal material showed evidence of microdeletion or microduplication, including three independent events that likely resulted from unequal crossing-over between segmental duplications. One of the microdeletions, identified in a fetus with multicystic dysplastic kidneys, encompasses the TCF2 gene on 17q12, previously shown to be mutated in maturity-onset diabetes, as well as in a subset of pediatric renal abnormalities. Fine-scale mapping of the breakpoints in different patient cohorts revealed a recurrent 1.5-Mb de novo deletion in individuals with phenotypes that ranged from congenital",2007-11-27,Am J Hum Genet,American journal of human genetics,"Adult; Aged; Autopsy; Chromosome Deletion; Chromosomes, Human, Pair 17; Diabetes Mellitus; Epilepsy; Female; Fetus; Gene Dosage; Gene Duplication; Gene Rearrangement; Genetic Predisposition to Disease; Genome, Human; Humans; Kidney Diseases; Male; Middle Aged; Nucleic Acid Hybridization; Pedigree; Phenotype",Mefford,Heather C,2021-09-15
109,pub109,case_series,3,2021-11-01,18039948,10.1136/jmg.2007.051839,cheroki2007.pdf,Genomic imbalances associated with mullerian aplasia.,"Aplasia of the m..llerian ducts leads to absence of the uterine corpus, uterine cervix, and upper (superior) vagina. Patients with m..llerian aplasia (MA) often exhibit additional clinical features such as renal, vertebral and cardiac defects. A number of different syndromes have been associated with MA, and in most cases its aetiology remains poorly understood. 14 syndromic patients with MA and 46,XX G-banded karyotype were screened for DNA copy number changes by approximately 1 Mb whole genome bacterial artificial chromosome (BAC) array based comparative genomic hybridisation (CGH). The detected alterations were validated by an independent method and further mapped by high resolution oligo-arrays. Submicroscopic genomic imbalances affecting the 1q21.1, 17q12, 22q11.21, and Xq21.31 chromosome regions were detected in four probands. Presence of the alterations in the normal mother of one patient suggests incomplete penetrance and/or variable expressivity. 4 of the 14 patients (29%) wer",2008-04-30,J Med Genet,Journal of medical genetics,"Abnormalities, Multiple; Adolescent; Adult; Allelic Imbalance; Child, Preschool; Chromosome Aberrations; Chromosome Deletion; Chromosomes, Human, Pair 1; Chromosomes, Human, Pair 17; Chromosomes, Human, Pair 22; Chromosomes, Human, X; Cytoskeletal Proteins; Female; Gene Dosage; Genitalia, Female; Homeodomain Proteins; Humans; LIM-Homeodomain Proteins; Middle Aged; Mullerian Ducts; Nucleic Acid Hybridization; Syndrome; Transcription Factors; Uterus; Vagina; Wnt Proteins; Wnt4 Protein",Cheroki,C,2021-09-15
110,pub110,case_report,3,2021-11-01,19889212,10.1186/1750-1172-4-25,bernardini2009.pdf,Recurrent microdeletion at 17q12 as a cause of Mayer-Rokitansky-Kuster-Hauser (MRKH) syndrome: two case reports.,"Mayer-Rokitansky-Kuster-Hauser syndrome (MRKH) consists of congenital aplasia of the uterus and the upper part of vagina due to anomalous development of M..llerian ducts, either isolated or associated with other congenital malformations, including renal, skeletal, hearing and heart defects. This disorder has an incidence of approximately 1 in 4500 newborn girls and the aetiology is poorly understood. we report on two patients affected by MRKH syndrome in which array-CGH analysis disclosed an identical deletion spanning 1.5 Mb of genomic DNA at chromosome 17q12. One patient was affected by complete absence of uterus and vagina, with bilaterally normal ovaries, while the other displayed agenesis of the upper part of vagina, right unicornuate uterus, non cavitating rudimentary left horn and bilaterally multicystic kidneys. The deletion encompassed two candidate genes, TCF2 and LHX1. Mutational screening of these genes in a selected group of 20 MRKH females without 17q12 deletion was negat",2010-01-07,Orphanet J Rare Dis,Orphanet journal of rare diseases,"Abnormalities, Multiple; Adolescent; Adult; Bone and Bones; Chromosome Deletion; Chromosomes, Human, Pair 17; Comparative Genomic Hybridization; Female; Heart Defects, Congenital; Hepatocyte Nuclear Factor 1-beta; Homeodomain Proteins; Humans; Kidney; LIM-Homeodomain Proteins; Syndrome; Transcription Factors; Uterus; Vagina",Bernardini,Laura,2021-09-15
111,pub111,research,3,2021-11-01,19417042,10.1210/jc.2008-2189,raile2009.pdf,Expanded clinical spectrum in hepatocyte nuclear factor 1b-maturity-onset diabetes of the young.,"HNF1B-maturity-onset diabetes of the young is caused by abnormalities in the HNF1B gene encoding the transcription factor HNF-1beta. We aimed to investigate detailed clinical features and the type of HNF1B gene anomaly in five pediatric cases with HNF1B-MODY. From a cohort of 995 children and adolescents with diabetes, we analyzed the most frequent maturity-onset diabetes of the young genes (GCK, HNF1A, HNF4A) including HNF1B sequencing and deletion analysis by quantitative Multiplex-PCR of Short Fluorescent Fragments (QMPSF) if patients were islet autoantibody-negative and had one parent with diabetes or associated extrapancreatic features or detectable C-peptide outside honeymoon phase. Presence and size of disease-causing chromosomal rearrangements detected by QMPSF were further analyzed by array comparative genomic hybridization. Overall, five patients had a heterozygous HNF1B deletion, presenting renal disease, elevated liver enzymes, and diabetes. Diabetes was characterized by in",2009-08-06,J Clin Endocrinol Metab,The Journal of clinical endocrinology and metabolism,"Adolescent; Chromosome Deletion; Chromosomes, Human, Pair 17; Cohort Studies; Comparative Genomic Hybridization; DNA Mutational Analysis; Diabetes Mellitus, Type 2; Female; Hepatocyte Nuclear Factor 1-beta; Humans; Male",Raile,Klemens,2021-09-15
112,pub112,case_series,3,2021-11-01,20587423,10.1093/ndt/gfq380,loirat2010.pdf,Autism in three patients with cystic or hyperechogenic kidneys and chromosome 17q12 deletion.,"We report autism in 3 out of 53 children with cystic or hyperechogenic kidneys and heterozygous 17q12 region deletion encompassing hepatocyte nuclear factor-1beta (HNF1B). They presented mental retardation, social interaction impairments, verbal and non-verbal communication deficits and stereotyped behaviours. Deletion size and location of breakpoints were similar to those reported in patients with renal disease/diabetes only. Reciprocal genomic rearrangements of the 17q12 region, reported in patients with mental retardation and epilepsy, could also be involved in autism. Nephrologists should be aware of the possibility of autism in patients with 17q12 deletion including HNF1B locus.",2011-01-13,Nephrol Dial Transplant,"Nephrology, dialysis, transplantation : official publication of the European Dialysis and Transplant Association - European Renal Association","Autistic Disorder; Child; Child, Preschool; Chromosome Deletion; Chromosomes, Human, Pair 17; Hepatocyte Nuclear Factor 1-beta; Homeodomain Proteins; Humans; Kidney Diseases, Cystic; LIM-Homeodomain Proteins; Male; Transcription Factors; Ultrasonography",Loirat,Chantal,2021-09-15
113,pub113,research,3,2021-11-01,21055719,10.1016/j.ajhg.2010.10.004,moreno-de-luca2010.pdf,Deletion 17q12 is a recurrent copy number variant that confers high risk of autism and schizophrenia.,"Autism spectrum disorders (ASD) and schizophrenia are neurodevelopmental disorders for which recent evidence indicates an important etiologic role for rare copy number variants (CNVs) and suggests common genetic mechanisms. We performed cytogenomic array analysis in a discovery sample of patients with neurodevelopmental disorders referred for clinical testing. We detected a recurrent 1.4 Mb deletion at 17q12, which harbors HNF1B, the gene responsible for renal cysts and diabetes syndrome (RCAD), in 18/15,749 patients, including several with ASD, but 0/4,519 controls. We identified additional shared phenotypic features among nine patients available for clinical assessment, including macrocephaly, characteristic facial features, renal anomalies, and neurocognitive impairments. In a large follow-up sample, the same deletion was identified in 2/1,182 ASD/neurocognitive impairment and in 4/6,340 schizophrenia patients, but in 0/47,929 controls (corrected p = 7.37 .. 10......). These data de",2011-01-24,Am J Hum Genet,American journal of human genetics,"Child; Child Development Disorders, Pervasive; Child, Preschool; Chromosomes, Human, Pair 17; DNA Copy Number Variations; Facies; Female; Humans; Male; Phenotype; Schizophrenia; Sequence Deletion",Moreno-De-Luca,Daniel,2021-09-15
114,pub114,case_series,3,2021-11-01,19844256,10.1038/ejhg.2009.174,nagamani2009.pdf,Clinical spectrum associated with recurrent genomic rearrangements in chromosome 17q12.,"Deletions in chromosome 17q12 encompassing the HNF1 beta gene cause cystic renal disease and maturity onset diabetes of the young, and have been recently described as the first recurrent genomic deletion leading to diabetes. Earlier reports of patients with this microdeletion syndrome have suggested an absence of cognitive impairment, differentiating it from most other contiguous gene deletion syndromes. The reciprocal duplication of 17q12 is rare and has been hypothesized to be associated with an increased risk of epilepsy and mental retardation. We conducted a detailed clinical and molecular characterization of four patients with a deletion and five patients with a reciprocal duplication of this region. Our patients with deletion of 17q12 presented with cognitive impairment, cystic renal disease, seizures, and structural abnormalities of the brain. Patients with reciprocal duplications manifest with cognitive impairment and behavioral abnormalities, but not with seizures. Our finding",2010-05-18,Eur J Hum Genet,European journal of human genetics : EJHG,"Adolescent; Child; Child, Preschool; Chromosome Aberrations; Chromosome Deletion; Chromosomes, Human, Pair 17; Cohort Studies; Comparative Genomic Hybridization; Female; Gene Duplication; Gene Rearrangement; Genome, Human; Hepatocyte Nuclear Factor 1-beta; Humans; Infant; Infant, Newborn; Magnetic Resonance Imaging; Male; Phenotype; Pregnancy; Recurrence; Young Adult",Nagamani,Sandesh Chakravarthy Sreenath,2021-09-15
115,pub115,research,3,2021-11-01,21278390,10.1136/jmg.2010.082412,nik-zainal2011.pdf,High incidence of recurrent copy number variants in patients with isolated and syndromic M..llerian aplasia.,"Congenital malformations involving the M..llerian ducts are observed in around 5% of infertile women. Complete aplasia of the uterus, cervix, and upper vagina, also termed M..llerian aplasia or Mayer-Rokitansky-Kuster-Hauser (MRKH) syndrome, occurs with an incidence of around 1 in 4500 female births, and occurs in both isolated and syndromic forms. Previous reports have suggested that a proportion of cases, especially syndromic cases, are caused by variation in copy number at different genomic loci. In order to obtain an overview of the contribution of copy number variation to both isolated and syndromic forms of M..llerian aplasia, copy number assays were performed in a series of 63 cases, of which 25 were syndromic and 38 isolated. A high incidence (9/63, 14%) of recurrent copy number variants in this cohort is reported here. These comprised four cases of microdeletion at 16p11.2, an autism susceptibility locus not previously associated with M..llerian aplasia, four cases of microdel",2011-05-26,J Med Genet,Journal of medical genetics,"46, XX Disorders of Sex Development; Abnormalities, Multiple; Adolescent; Adult; Chromosome Deletion; Cohort Studies; Congenital Abnormalities; DNA Copy Number Variations; Female; Genetic Testing; Humans; Incidence; Kidney; Mullerian Ducts; Somites; Spine; Syndrome; Uterus; Vagina; Young Adult",Nik-Zainal,Serena,2021-09-15
116,pub116,case_series,3,2021-11-01,21858020,10.1371/journal.pone.0023182,kasperaviciute2011.pdf,Uncovering genomic causes of co-morbidity in epilepsy: gene-driven phenotypic characterization of rare microdeletions.,"Patients with epilepsy often suffer from other important conditions. The existence of such co-morbidities is frequently not recognized and their relationship with epilepsy usually remains unexplained. We describe three patients with common, sporadic, non-syndromic epilepsies in whom large genomic microdeletions were found during a study of genetic susceptibility to epilepsy. We performed detailed gene-driven clinical investigations in each patient. Disruption of the function of genes in the deleted regions can explain co-morbidities in these patients. Co-morbidities in patients with epilepsy can be part of a genomic abnormality even in the absence of (known) congenital malformations or intellectual disabilities. Gene-driven phenotype examination can also reveal clinically significant unsuspected condition.",2012-02-15,PLoS One,PloS one,"Abnormalities, Multiple; Adult; Chromosome Deletion; Chromosome Disorders; Chromosomes, Human, Pair 12; Chromosomes, Human, Pair 17; Chromosomes, Human, Pair 3; Comorbidity; Epilepsy; Female; Gene Deletion; Genetic Association Studies; Genetic Predisposition to Disease; Humans; Male",Kasperavi..i..t..,Dalia,2021-09-15
117,pub117,case_report,3,2021-11-01,24487052,10.1016/j.gene.2014.01.050,palumbo2014.pdf,Variable phenotype in 17q12 microdeletions: clinical and molecular characterization of a new case.,"Microdeletions of 17q12 including the hepatocyte nuclear factor 1 beta (HNF1B) gene, as well as point mutations of this gene, are associated with the Renal Cysts and Diabetes syndrome (RCAD, OMIM 137920) and genitourinary alterations. Also, microdeletions encompassing HNF1B were identified as a cause of Mayer-Rokitansky-K..ster-Hauser Syndrome (MRKH, OMIM 277000) in females and, recently, were associated with intellectual disability, autistic features, cerebral anomaly and facial dysmorphisms. In this report, we describe a boy with a deletion in 17q12 region detected by SNP array, encompassing the HNF1B gene, that showed dysmorphic features, intellectual disability (ID), serious speech delay and autistic features. In addition, obesity was observed. In order to study the parental origin of the rearrangement, we analyzed selected SNPs in the deleted area in the patient and his parents, showing Mendelian incompatibilities suggesting a de novo deletion on the chromosome of maternal origin.",2014-04-14,Gene,Gene,"17q12; HNF1B; Intellectual disability; Renal Cysts and Diabetes syndrome; SNP array; Abnormalities, Multiple; Acetyl-CoA Carboxylase; Autistic Disorder; Child; Chromosome Deletion; Chromosomes, Human, Pair 17; Female; Forkhead Transcription Factors; Haploinsufficiency; Haplotypes; Hepatocyte Nuclear Factor 1-beta; Humans; Intellectual Disability; LIM-Homeodomain Proteins; Language Development Disorders; Male; Phenotype; Polymorphism, Single Nucleotide; Transcription Factors",Palumbo,Pietro,2021-09-15
118,pub118,case_report,3,2021-11-01,25256560,10.1002/ajmg.a.36767,quintero-rivera2014.pdf,Duodenal atresia in 17q12 microdeletion including HNF1B: a new associated malformation in this syndrome.,"Deletions of chromosome 17q12 [OMIM 614527] encompass a wide range of phenotypes, including renal cysts, diabetes mellitus, pancreatic structural abnormalities, genital tract anomalies, developmental delay, learning difficulties, and more recently, autism spectrum disorder and schizophrenia. To date, gastrointestinal malformations have not been fully characterized in this syndrome. In this case report, we describe a four-year-old girl with a 17q12 microdeletion who was born with duodenal atresia, bilateral renal cysts, left kidney dysplasia, a midline cystic structure at the conus medullaris, and dysmorphic features. Both the patient and her affected father were found to have a deletion of 17q12, which encompasses the HNF1B (hepatocyte nuclear factor beta). It is hypothesized that HNF1B may play a role in intestinal differentiation and development. Our clinical report further expands the pre-and post-natal presentation of this rare microdeletion syndrome.",2015-07-10,Am J Med Genet A,American journal of medical genetics. Part A,"17q12 microdeletion; TCF2, review; duodenal atresia; hepatocyte nuclear factor beta (HNF1B); pathology; prenatal; renal cysts; Abnormalities, Multiple; Chromosome Aberrations; Chromosomes, Human, Pair 17; Duodenal Obstruction; Female; Hepatocyte Nuclear Factor 1-beta; Humans; Intestinal Atresia; Microarray Analysis; Phenotype; Syndrome",Quintero-Rivera,Fabiola,2021-09-15
119,pub119,case_report,3,2021-11-01,24991439,10.1155/2014/264947,roberts2014.pdf,Clinical report of a 17q12 microdeletion with additionally unreported clinical features.,"Copy number variations involving the 17q12 region have been associated with developmental and speech delay, autism, aggression, self-injury, biting and hitting, oppositional defiance, inappropriate language, and auditory hallucinations. We present a tall-appearing 17-year-old boy with marfanoid habitus, hypermobile joints, mild scoliosis, pectus deformity, widely spaced nipples, pes cavus, autism spectrum disorder, intellectual disability, and psychiatric manifestations including physical and verbal aggression, obsessive-compulsive behaviors, and oppositional defiance. An echocardiogram showed borderline increased aortic root size. An abdominal ultrasound revealed a small pancreas, mild splenomegaly with a 1.3...cm accessory splenule, and normal kidneys and liver. A testing panel for Marfan, aneurysm, and related disorders was negative. Subsequently, a 400...K array-based comparative genomic hybridization (aCGH) + SNP analysis was performed which identified a de novo suspected pathogen",2014-07-03,Case Rep Genet,Case reports in genetics,NULL,Roberts,Jennifer L,2021-09-15
120,pub120,case_report,3,2021-11-01,25425496,10.1002/ajmg.a.36840,goumy2014.pdf,Congenital diaphragmatic hernia may be associated with 17q12 microdeletion syndrome.,"Microdeletions of 17q12 encompassing TCF2 are associated with maturity-onset of diabetes of the young type 5, cystic renal disease, pancreatic atrophy, Mullerian aplasia in females and variable cognitive impairment. We report on a patient with a de novo 17q12 microdeletion, 1.8...Mb in size, associated with congenital diaphragmatic hernia (CDH). The 5-year-old male patient presented multicystic renal dysplasia kidneys, minor facial dysmorphic features and skeletal anomalies, but neither developmental delay nor behavioral abnormalities. CDH has been previously associated with the 17q12 microdeletion syndrome only in one prenatal case. The present study reinforces the hypothesis that CDH is part of the phenotype for 17q12 microdeletion and that 17q12 encompasses candidate(s) gene(s) involved in diaphragm development. We suggest that PIGW, a gene involved in an early step of GPI biosynthesis, could be a strong candidate gene for CDH.",2015-08-19,Am J Med Genet A,American journal of medical genetics. Part A,"17q12 microdeletion; PIGW gene; array CGH; congenital diaphragmatic hernia; Child, Preschool; Chromosome Deletion; Chromosomes, Human, Pair 17; Comparative Genomic Hybridization; Facies; Hernias, Diaphragmatic, Congenital; Humans; Infant; Infant, Newborn; Syndrome",Goumy,Carole,2021-09-15
121,pub121,case_series,3,2021-11-01,25324567,10.1136/archdischild-2014-306810,laffargue2014.pdf,Towards a new point of view on the phenotype of patients with a 17q12 microdeletion syndrome.,"17q12 microdeletion syndrome involves 15 genes, including HNF1B, and is considered to confer a high risk of neuropsychiatric disorders. Patients with HNF1B gene deletion diagnosed secondary to renal disorders are only very rarely reported to have neuropsychiatric disorders. Interestingly, however, when tested, patients with HNF1B gene deletion are found to have 17q12 deletion. This brings into question the extent to which 17q12 deletion is genuinely associated with severe neuropsychological disorders and in which patients. In this study, we sought to confirm 17q12 microdeletion in kidney patients initially diagnosed with HNF1B gene deletion and evaluate neuropsychological disorders in these patients compared with those with HNF1B point mutation. Thirty-nine children with HNF1B disorders (26 with deletions) diagnosed secondary to renal abnormalities were included in this prospective study and tested for 17q12 microdeletion and neuropsychological disorders. The same 17q12 microdeletion f",2015-05-28,Arch Dis Child,Archives of disease in childhood,"Genetics; Nephrology; Neurodevelopment; Adolescent; Central Nervous System Diseases; Child; Child, Preschool; Chromosome Deletion; Chromosomes, Human, Pair 17; Dental Enamel; Diabetes Mellitus, Type 2; Female; France; Hepatocyte Nuclear Factor 1-beta; Humans; In Situ Hybridization, Fluorescence; Infant; Kidney Diseases, Cystic; Male; Mental Disorders; Phenotype; Prospective Studies",Laffargue,Fanny,2021-09-15
122,pub122,review_and_cases,3,2021-11-01,27409573,10.1002/ajmg.a.37848,rasmussen2016.pdf,17q12 deletion and duplication syndrome in Denmark-A clinical cohort of 38 patients and review of the literature.,"17q12 deletions and duplications are two distinct, recurrent chromosomal aberrations usually diagnosed by chromosomal microarray analysis (CMA). The aberrations encompass the genes, HNF1B, LHX1, and ACACA, among others. We here describe a large national cohort of 12 phenotyped patients with 17q12 deletions and 26 phenotyped patients with 17q12 duplications. The total cohort includes 19 index patients and 19 family members. We also reviewed the literature in order to further improve the basis for the counseling. We emphasize that renal disease, learning disability, behavioral abnormalities, epilepsy, autism, schizophrenia, structural brain abnormalities, facial dysmorphism, and joint laxity are features seen in both the 17q12 deletion syndrome and the reciprocal 17q12 duplication syndrome; and we extend the list of features seen in both patient categories to include strabismus, esophageal defects, and duodenal atresia. Delayed language development, learning disability, kidney involvemen",2017-10-19,Am J Med Genet A,American journal of medical genetics. Part A,"17q12 deletion; 17q12 duplication; array cgh; chromosomal microarray; genetic counselling; kidney anomalies; learning disability; prenatal diagnostics; snp array; Abnormalities, Multiple; Adolescent; Adult; Child; Child, Preschool; Chromosome Aberrations; Chromosome Deletion; Chromosome Disorders; Chromosome Duplication; Chromosomes, Human, Pair 17; Comparative Genomic Hybridization; Denmark; Facies; Humans; Infant; Infant, Newborn; Inheritance Patterns; Phenotype; Polymorphism, Single Nucleotide; Registries; Syndrome; Young Adult",Rasmussen,Maria,2021-09-15
