publication_id,publication_alias,publication_type,publication_user_id,publication_entry_date,PMID,DOI,PDF,title,abstract,publication_date,journal_abbreviation,journal,keywords,firstauthor_lastname,firstauthor_firstname,update_date
73,pub073,case_series,3,2021-11-01,27297286,10.1002/pd.4858,duval2016.pdf,Fetal anomalies associated with HNF1B mutations: report of 20 autopsy cases.,"To describe macroscopic and microscopic anomalies present in fetuses carrying hepatocyte nuclear factor-1 .. mutation, their frequency, and genotype/phenotype correlations. Clinical data, ultrasound findings, genetic studies, and autopsy reports of 20 fetal autopsies were analyzed. Histology was reviewed by two pathologists. Macroscopic findings were typically unilateral or bilateral renal enlargement and cortical cysts. Renal lesions were associated with congenital anomalies of the kidney and urinary tract in 25% of cases. Microscopic renal anomalies were dominated by glomerulocystic kidney and renal dysplasia. Extra-renal manifestations such as pancreatic hypoplasia (75%) and genital anomalies (68%) were only detected at autopsy. In 40% of cases, there was heterozygous deletion of the whole gene. There were de novo mutations in 40%. This study underlines the importance of considering hepatocyte nuclear factor-1 .. mutations in fetuses with congenital anomalies of the kidney and urina",2017-08-31,Prenat Diagn,Prenatal diagnosis,"Autopsy; Congenital Abnormalities; Female; Genotype; Hepatocyte Nuclear Factor 1-beta; Humans; Kidney; Male; Mutation; Pancreas; Pancreatic Diseases; Phenotype; Pregnancy; Ultrasonography, Prenatal; Urogenital Abnormalities",Duval,H..l..ne,2021-09-15
74,pub074,NULL,3,2021-11-01,30259503,10.5603/EP.a2018.0064,komazec2018.pdf,The importance of combined NGS and MLPA genetic tests for differential diagnosis of maturity onset diabetes of the young.,"Maturity onset diabetes of the young (MODY) is a rare form of monogenic diabetes. Being clinically and genetically heterogeneous, it is often misdiagnosed as type 1 or type 2 diabetes, leading to inappropriate therapy. MODY is caused by a single gene mutation. Thirteen genes, defining 13 subtypes, have been identified to cause MODY. A correct diagnosis is important for the right therapy, prognosis, and genetic counselling. Twenty-nine unrelated paediatric patients clinically suspected of having MODY diabetes were analysed using TruSight One panel for next-generation sequencing (NGS) and multiplex ligation-dependent probe amplification (MLPA) assay. In this study we identified variants in MODY genes in 22 out of 29 patients (75.9%). Using two genetic tests, NGS and MLPA, we detected both single nucleotide variants and large deletions in patients. Most of the patients harboured a variant in the GCK gene (11/22), followed by HNF1B (5/22). The rest of the variants were found in the NEUROD1",2019-07-12,Endokrynol Pol,Endokrynologia Polska,"MLPA; MODY; NGS; differential diagnosis; Adolescent; Adult; Child; Diabetes Mellitus, Type 2; Diagnosis, Differential; Female; Genetic Testing; High-Throughput Nucleotide Sequencing; Humans; Male; Multiplex Polymerase Chain Reaction; Mutation; Sequence Analysis, DNA; Young Adult",Komazec,Jovana,2021-09-15
75,pub075,case_report,3,2021-11-01,28912863,10.3892/etm.2017.4871,lv2017.pdf,A novel mutation in the hepatocyte nuclear factor-1.. gene in maturity onset diabetes of the young 5 with multiple renal cysts and pancreas hypogenesis: A case report.,"A 17-year-old Chinese male was hospitalized exhibiting hyperglycemia and increased serum urea nitrogen and creatinine levels in addition to weight loss. The patient was treated with gliclazide. The patient was 150 cm tall, weighed 35 kg and had no family history of diabetes or kidney disease. Physical examination revealed cephalus quadratus, rachitic rosary and a visible toe-out gait. Laboratory examinations revealed that the patient's fasting plasma glucose and glycosylated hemoglobin levels were markedly increased, fasting plasma C-peptide level was slightly increased and no peak 2 h postprandial was observed. Diabetic autoimmune antibodies [islet cell cytoplasmic autoantibodies (ICA), glutamic acid decarboxylase autoantibodies (GADA), isulinoma-2-associated autoantibodies (IA2A) and insulin autoantibodies (IAA)] were negative. Levels of serum electrolytes decreased, uric acid and parathyroid hormone increased, mild albuminuria was detected and there was a low proportion of urine. Th",2020-10-01,Exp Ther Med,Experimental and therapeutic medicine,hepatocyte nuclear factor-1..; maturity onset diabetes of the young 5; mutation; pancreas hypogenesis; renal cysts,Lv,You,2021-09-15
76,pub076,NULL,3,2021-11-01,26417411,10.1111/jdi.12334,yabe2015.pdf,Establishment of maturity-onset diabetes of the young-induced pluripotent stem cells from a Japanese patient.,"Maturity-onset diabetes of the young (MODY) is a heterozygous monogenic diabetes; more than 13 disease genes have been identified. However, the pathogenesis of MODY is not fully understood, because the pancreatic ..-cells of the patients are inaccessable. Therefore, we attempted to establish MODY patient-derived induced pluripotent stem cells (MODY-iPS) cells to investigate the pathogenic mechanism of MODY by inducing pancreatic ..-cells. We established MODY5-iPS cells from a Japanese patient with MODY5 (R177X), and confirmed that MODY5-iPS cells possessed the characteristics of pluripotent stem cells. In the course of differentiation from MODY5-iPS cells into pancreatic ..-cells, we examined the disease gene, HNF1B messenger ribonucleic acid. We found that the amount of R177X mutant transcripts was much less than that of wild ones, but they increased after adding cycloheximide to the medium. These results suggest that these R177X mutant messenger ribonucleic acids are disrupted by non",2015-09-29,J Diabetes Investig,Journal of diabetes investigation,Diabetes; Maturity-onset diabetes of the young; Pluripotent stem cells,Yabe,Shigeharu G,2021-09-15
77,pub077,case_report,3,2021-11-01,26899772,10.1111/petr.12690,kanda2016.pdf,New-onset diabetes after renal transplantation in a patient with a novel HNF1B mutation.,"CAKUT are the most frequent causes of ESRD in children. Mutations in the gene encoding HNF1B, a transcription factor involved in organ development and maintenance, cause a multisystem disorder that includes CAKUT, diabetes, and liver dysfunction. Here, we describe the case of a patient with renal hypodysplasia who developed NODAT presenting with liver dysfunction. The NODAT was initially thought to be steroid and FK related. However, based on the patient's clinical features, including renal hypodysplasia and recurrent elevations of transaminase, screening for an HNF1B mutation was performed. Direct sequencing identified a novel splicing mutation of HNF1B, designated c.344 + 2T&gt;C. Because CAKUT is the leading cause of ESRD in children and HNF1B mutations can cause both renal hypodysplasia and diabetes, HNF1B mutations may account for a portion of the cases of NODAT in pediatric patients who have undergone kidney transplantation. NODAT is a serious and major complication of solid orga",2017-03-03,Pediatr Transplant,Pediatric transplantation,"HNF1B; NODAT; complications; pediatric kidney transplantation; Adolescent; Adult; Alternative Splicing; Child; Child, Preschool; Diabetes Mellitus; Female; Graft Survival; Hepatocyte Nuclear Factor 1-beta; Humans; Kidney; Kidney Diseases; Kidney Transplantation; Male; Mutation; Pediatrics; Renal Insufficiency; Sequence Analysis, DNA; Steroids; Transaminases; Urogenital Abnormalities; Vesico-Ureteral Reflux",Kanda,Shoichiro,2021-09-15
78,pub078,case_series,3,2021-11-01,25441779,10.1111/ahg.12093,kanthimathi2014.pdf,Identification and molecular characterization of HNF1B gene mutations in Indian diabetic patients with renal abnormalities.,"Heterozygous mutations of the HNF1B gene (HNF1B-MODY or MODY5) are associated with a wide clinical spectrum of renal and extrarenal disease without clear genotype-phenotype correlation. In this study, we investigated the prevalence of HNF1B gene mutations in young Indian diabetic patients with various renal abnormalities. Fifty unrelated young diabetic patients, who also had renal abnormalities, were selected from the electronic records of a large diabetes centre in Chennai, in southern India. All patients were sequenced for HNF1B gene mutations. The whole or partial gene deletion was analyzed by MLPA. Functional characterization of the novel variant (Asn321Asp) was also performed using transcriptional activation and subcellular localization assays. We identified six different HNF1B gene mutations which included four previously reported (-67C&gt;T, Arg165His, IVS2nt+2insT, Met1_Trp557del) and two novel variations (Asn321Asp, IVS3nt-4C&gt;G). The functional study revealed that the novel",2015-05-29,Ann Hum Genet,Annals of human genetics,"Asian Indians; MLPA; MODY5; RCAD; South Asians; autoantibody-negative type 1 diabetes; renal cyst; Adolescent; Adult; Aged; Amino Acid Sequence; Asian Continental Ancestry Group; Child; Cohort Studies; DNA Mutational Analysis; Diabetes Mellitus; Female; Gene Deletion; HEK293 Cells; HeLa Cells; Hepatocyte Nuclear Factor 1-beta; Humans; India; Male; Middle Aged; Molecular Sequence Data; Pedigree; Promoter Regions, Genetic; RNA Splice Sites; Transcriptional Activation; Young Adult",Kanthimathi,Sekar,2021-09-15
79,pub079,case_report,3,2021-11-01,28593362,10.1007/s00592-017-1007-9,luo2017.pdf,Hepatocyte nuclear factor 1.. maturity-onset diabetes of the young in a Chinese child presenting with hyperglycemic hyperosmolar state.,NULL,2019-11-20,Acta Diabetol,Acta diabetologica,HNF1.. gene; HNF1..-MODY; Hyperglycemic hyperosmolar state,Luo,Yue,2021-09-15
80,pub080,case_series,3,2021-11-01,28251383,10.1007/s10157-017-1396-7,horinouchi2017.pdf,Diagnostic strategy for inherited hypomagnesemia.,"Hereditary hypomagnesemia is difficult to diagnose accurately because of its rarity and the variety of causative genes. We established a flowchart for identifying responsible genes for hypomagnesemia, and we confirmed its diagnostic efficacy in patients with suspected inherited hypomagnesemia. We established a flowchart and applied it to five index cases with suspected inherited hypomagnesemia. Direct sequence analysis was used to detect the causative gene variants in four cases, and targeted sequencing analysis using next-generation sequencing (NGS) of all causative genes for hypomagnesemia was used in one. Expected pathogenic variants were detected in the HNF1B, TRPM6, CLDN16, CASR, or SLC12A3 gene in all five cases. The results of all genetic analyses were consistent with the clinical diagnostic results using the flowchart. Accurate genetic diagnosis is crucial for estimating the prognosis, detecting complications in organs other than the kidneys, and for directing genetic counselin",2018-07-13,Clin Exp Nephrol,Clinical and experimental nephrology,"Diagnostic flowchart; Hereditary hypomagnesemia; Next-generation sequencing; Adult; Child; Child, Preschool; Female; Humans; Hypercalciuria; Infant; Male; Nephrocalcinosis; Renal Tubular Transport, Inborn Errors; Young Adult",Horinouchi,Tomoko,2021-09-15
81,pub081,NULL,3,2021-11-01,26489029,10.1038/ki.2015.317,braun2016.pdf,Whole exome sequencing identifies causative mutations in the majority of consanguineous or familial cases with childhood-onset increased renal echogenicity.,"Chronically increased echogenicity on renal ultrasound is a sensitive early finding of chronic kidney disease that can be detected before manifestation of other symptoms. Increased echogenicity, however, is not specific for a certain etiology of chronic kidney disease. Here, we performed whole exome sequencing in 79 consanguineous or familial cases of suspected nephronophthisis in order to determine the underlying molecular disease cause. In 50 cases, there was a causative mutation in a known monogenic disease gene. In 32 of these cases whole exome sequencing confirmed the diagnosis of a nephronophthisis-related ciliopathy. In 8 cases it revealed the diagnosis of a renal tubulopathy. The remaining 10 cases were identified as Alport syndrome (4), autosomal-recessive polycystic kidney disease (2), congenital anomalies of the kidney and urinary tract (3), and APECED syndrome (1). In 5 families, in whom mutations in known monogenic genes were excluded, we applied homozygosity mapping for v",2017-01-10,Kidney Int,Kidney international,"Age of Onset; Cohort Studies; DNA Mutational Analysis; Exome; Humans; Kidney Diseases, Cystic; Renal Insufficiency, Chronic",Braun,Daniela A,2021-09-15
82,pub082,NULL,3,2021-11-01,24041679,10.2337/dc13-0698,bonnefond2013.pdf,Highly sensitive diagnosis of 43 monogenic forms of diabetes or obesity through one-step PCR-based enrichment in combination with next-generation sequencing.,"Accurate etiological diagnosis of monogenic forms of diabetes and obesity is useful as it can lead to marked improvements in patient care and genetic counseling. Currently, molecular diagnosis based on Sanger sequencing is restricted to only a few genes, as this technology is expensive, time-consuming, and labor-intensive. High-throughput next-generation sequencing (NGS) provides an opportunity to develop innovative cost-efficient methods for sensitive diabetes and obesity multigene screening. We assessed a new method based on PCR enrichment in microdroplets (RainDance Technologies) and NGS using the Illumina HiSeq2000 for the molecular diagnosis of 43 forms of monogenic diabetes or obesity. Forty patients carrying a known causal mutation for those subtypes according to diagnostic laboratories were blindly reanalyzed. Except for one variant, we reidentified all causal mutations in each patient associated with an almost-perfect sequencing of the targets (mean of 98.6%). We failed to cal",2014-11-28,Diabetes Care,Diabetes care,"Adolescent; Child; Child, Preschool; Cost-Benefit Analysis; Diabetes Mellitus; High-Throughput Nucleotide Sequencing; Humans; Mutation; Obesity; Polymerase Chain Reaction; Sensitivity and Specificity",Bonnefond,Am..lie,2021-09-15
83,pub083,NULL,3,2021-11-01,29406598,10.1111/jdi.12812,horikawa2018.pdf,Maturity-onset diabetes of the young as a model for elucidating the multifactorial origin of type 2 diabetes mellitus.,"Maturity-onset diabetes of the young (MODY) is a form of diabetes classically characterized as having autosomal dominant inheritance, onset before the age of 25 years in at least one family member and partly preserved pancreatic ..-cell function. The 14 responsible genes are reported to be MODY type 1~14, of which MODY 2 and 3 might be the most common forms. Although MODY is currently classified as diabetes of a single gene defect, it has become clear that mutations in rare MODYs, such as MODY 5 and MODY 6, have small mutagenic effects and low penetrance. In addition, as there are differences in the clinical phenotypes caused by the same mutation even in the same family, other phenotypic modifying factors are thought to exist; MODY could well have characteristics of type 2 diabetes mellitus, which is of multifactorial origin. Here, we outline the effects of genetic and environmental factors on the known phenotypes of MODY, focusing mainly on the examples of MODY 5 and 6, which have low",2018-10-26,J Diabetes Investig,Journal of diabetes investigation,"Maturity-onset diabetes of the young; Penetrance; Type 2 diabetes mellitus; Basic Helix-Loop-Helix Transcription Factors; Diabetes Mellitus, Type 2; Hepatocyte Nuclear Factor 1-alpha; Hepatocyte Nuclear Factor 1-beta; Hepatocyte Nuclear Factor 4; Humans; Phenotype",Horikawa,Yukio,2021-09-15
84,pub084,screening_multiple,3,2021-11-01,24476040,10.1186/1471-2156-15-13,gao2014.pdf,Evaluation of a target region capture sequencing platform using monogenic diabetes as a study-model.,"Monogenic diabetes is a genetic disease often caused by mutations in genes involved in beta-cell function. Correct sub-categorization of the disease is a prerequisite for appropriate treatment and genetic counseling. Target-region capture sequencing is a combination of genomic region enrichment and next generation sequencing which might be used as an efficient way to diagnose various genetic disorders. We aimed to develop a target-region capture sequencing platform to screen 117 selected candidate genes involved in metabolism for mutations and to evaluate its performance using monogenic diabetes as a study-model. The performance of the assay was evaluated in 70 patients carrying known disease causing mutations previously identified in HNF4A, GCK, HNF1A, HNF1B, INS, or KCNJ11. Target regions with a less than 20-fold sequencing depth were either introns or UTRs. When only considering translated regions, the coverage was 100% with a 50-fold minimum depth. Among the 70 analyzed samples, 63",2014-09-16,BMC Genet,BMC genetics,"DNA Mutational Analysis; Diabetes Mellitus, Type 2; Gene Duplication; Humans; INDEL Mutation; Polymorphism, Single Nucleotide; Sequence Deletion",Gao,Rui,2021-09-15
85,pub085,case_report,3,2021-11-01,28502589,10.1016/j.jdiacomp.2016.11.011,wang2016.pdf,A case of a novel mutation in HNF1..-related maturity-onset diabetes of the young type 5 with diabetic kidney disease complication in a Chinese family.,"Precise diagnosis of maturity-onset diabetes of the young (MODY) has proven valuable for understanding mechanism of diabetes and selecting optimal therapy. A proband and her mother with diabetic kidney disease (DKD) were studied to investigate potential genes responsible for diabetes and different severity of DKD between the parent and offspring. The family with suspected MODY underwent mutational analyses by the whole exome sequencing (WES). Candidate pathogenic variants were validated by Sanger sequencing and tested for co-segregation. The clinical parameters of subjects were collected from medical records. A novel missense heterozygous mutation in exon 4 of the hepatocyte nuclear factor 1.. (HNF1..), c.1007A..&gt;..G (p.H336R), was identified in both the proband and her mother. Moreover, comparing the family's WES results, we found that the proband had acquired a KCNQ1 gene mutation from her father and acquired ACE and SORBS1 gene mutations from her mother. These three genes are kno",2018-04-02,J Diabetes Complications,Journal of diabetes and its complications,"Diabetic kidney disease; Hepatocyte nuclear factor 1.. gene; Maturity-onset Diabetes of the Young; Mutation; Whole exome sequencing; Amino Acid Substitution; Central Nervous System Diseases; China; DNA Mutational Analysis; Dental Enamel; Diabetes Mellitus, Type 2; Female; Hepatocyte Nuclear Factor 1-beta; Humans; KCNQ1 Potassium Channel; Kidney Diseases, Cystic; Microfilament Proteins; Middle Aged; Mothers; Mutation; Mutation, Missense; Peptidyl-Dipeptidase A; Severity of Illness Index; Whole Exome Sequencing",Wang,Yiting,2021-09-15
86,pub086,case_series,3,2021-11-01,26669242,10.1515/jpem-2015-0039,aladolu2016.pdf,Maturity onset diabetes of youth (MODY) in Turkish children: sequence analysis of 11 causative genes by next generation sequencing.,"Maturity-onset diabetes of the youth (MODY), is a genetically and clinically heterogeneous group of diseasesand is often misdiagnosed as type 1 or type 2 diabetes. The aim of this study is to investigate both novel and proven mutations of 11 MODY genes in Turkish children by using targeted next generation sequencing. A panel of 11 MODY genes were screened in 43 children with MODY diagnosed by clinical criterias. Studies of index cases was done with MISEQ-ILLUMINA, and family screenings and confirmation studies of mutations was done by Sanger sequencing. We identified 28 (65%) point mutations among 43 patients. Eighteen patients have GCK mutations, four have HNF1A, one has HNF4A, one has HNF1B, two have NEUROD1, one has PDX1 gene variations and one patient has both HNF1A and HNF4A heterozygote mutations. This is the first study including molecular studies of 11 MODY genes in Turkish children. GCK is the most frequent type of MODY in our study population. Very high frequency of novel mut",2017-01-13,J Pediatr Endocrinol Metab,Journal of pediatric endocrinology &amp; metabolism : JPEM,"Adolescent; Adult; Biomarkers; Child; Child, Preschool; Diabetes Mellitus, Type 2; Female; Follow-Up Studies; Genetic Testing; Germinal Center Kinases; Hepatocyte Nuclear Factor 1-alpha; High-Throughput Nucleotide Sequencing; Humans; Infant; Male; Mutation; Phenotype; Prognosis; Protein-Serine-Threonine Kinases; Turkey; Young Adult",A..lad..o..lu,Sebahat Y..lmaz,2021-09-15
87,pub087,research,3,2021-11-01,29927023,10.1111/pedi.12714,yorifuji2018.pdf,"Genetic basis of early-onset, maturity-onset diabetes of the young-like diabetes in Japan and features of patients without mutations in the major MODY genes: Dominance of maternal inheritance.","Causative mutations cannot be identified in the majority of Asian patients with suspected maturity-onset diabetes of the young (MODY). To elucidate the genetic basis of Japanese patients with MODY-like diabetes and gain insight into the etiology of patients without mutations in the major MODY genes. A total of 263 Japanese patients with early-onset, non-obese, MODY-like diabetes mellitus referred to Osaka City General Hospital for diagnosis. Mutational analysis of the four major MODY genes (GCK, HNF1A, HNF4A, HNF1B) by Sanger sequencing. Mutation-positive and mutation-negative patients were further analyzed for clinical features. Mutations were identified in 103 (39.2%) patients; 57 mutations in GCK; 29, HNF1A; 7, HNF4A; and 10, HNF1B. Contrary to conventional diagnostic criteria, 18.4% of mutation-positive patients did not have affected parents and 8.2% were in the overweight range (body mass index [BMI] &gt;85th percentile). HOMA-IR at diagnosis was elevated (&gt;2) in 15 of 66 (22.7",2019-05-30,Pediatr Diabetes,Pediatric diabetes,"Japanese; MODY; inheritance; type 2 diabetes; Adolescent; Adult; Child; Child, Preschool; Diabetes Mellitus, Type 2; Female; Germinal Center Kinases; Hepatocyte Nuclear Factors; Humans; Japan; Male; Maternal Inheritance; Protein-Serine-Threonine Kinases; Young Adult",Yorifuji,Tohru,2021-09-15
88,pub088,research,3,2021-11-01,25500806,10.1093/ndt/gfu370,raaijmakers2014.pdf,Criteria for HNF1B analysis in patients with congenital abnormalities of kidney and urinary tract.,"Congenital anomalies of kidneys and urinary tract (CAKUT) are the most predominant developmental disorders comprising ...20-30% of all anomalies identified in the prenatal period. Mutations in hepatocyte nuclear factor 1-beta (HNF-1..) involved in the development of kidneys, liver, pancreas and urogenital tract are currently the most frequent monogenetic cause of CAKUT found in 10-30% of patients depending on screening policy and study design. We aimed to validate criteria for analysis of HNF1B in a prospective cohort of paediatric and adult CAKUT patients. We included CAKUT patients diagnosed in our paediatric and adult nephrology departments from January 2010 until April 2013 based on predefined screening criteria. Subjects presenting with at least one major renal criterion or one minor renal criterion combined with one or more extra-renal criteria in the personal history or a familial history of renal or extra-renal manifestations were considered eligible. We prospectively screened ",2015-07-23,Nephrol Dial Transplant,"Nephrology, dialysis, transplantation : official publication of the European Dialysis and Transplant Association - European Renal Association","CAKUT; HNF1..; genetic screening; hepatocyte nuclear factor 1-beta; renal development; Adolescent; Adult; Child; Child, Preschool; DNA Mutational Analysis; Female; Hepatocyte Nuclear Factor 1-beta; Humans; Infant; Infant, Newborn; Kidney; Kidney Diseases; Kidney Diseases, Cystic; Male; Middle Aged; Mutation; Prospective Studies; Urinary Tract; Urologic Diseases; Young Adult",Raaijmakers,Anke,2021-09-15
89,pub089,research,3,2021-11-01,31198537,10.1093/ckj/sfy102,madariaga2018.pdf,Variable phenotype in <i>HNF1B</i> mutations: extrarenal manifestations distinguish affected individuals from the population with congenital anomalies of the kidney and urinary tract.,"Mutations in hepatocyte nuclear factor 1B (HNF1B) have been associated with congenital anomalies of the kidney and urinary tract (CAKUT) in humans. Diabetes and other less frequent anomalies have also been described. Variable penetrance and intrafamilial variability have been demonstrated including severe prenatal phenotypes. Thus, it is important to differentiate this entity from others with similar clinical features and perform confirmatory molecular diagnosis. This study reports the results of HNF1B screening in a cohort of 60 patients from 58 unrelated families presenting with renal structural anomalies and/or non-immune glucose metabolism alterations, and other minor features suggesting HNF1B mutations. This study identified a pathogenic variant in 23 patients from 21 families. The most frequent finding was bilateral cystic dysplasia or hyperechogenic kidneys (87% of patients). Sixty percent of them also fulfilled the criteria for impaired glucose metabolism, and these were signif",2020-09-29,Clin Kidney J,Clinical kidney journal,CAKUT; HNF1B; MODY; hypomagnesaemia; pancreatic structural anomalies,Madariaga,Leire,2021-09-15
