publication_id,publication_alias,publication_type,publication_user_id,publication_entry_date,PMID,DOI,PDF,title,abstract,publication_date,journal_abbreviation,journal,keywords,firstauthor_lastname,firstauthor_firstname,update_date
36,pub035,research,3,2021-11-01,15085338,10.1007/s00125-004-1383-x,hattersley2004.pdf,Abnormal splicing of hepatocyte nuclear factor-1 beta in the renal cysts and diabetes syndrome.,"Mutations in the hepatocyte nuclear factor-1 beta ( HNF-1 beta) gene result in disorders of renal development, typically involving renal cysts and early-onset diabetes (the RCAD syndrome/ MODY5). Sixteen mutations have been reported, including three splicing mutations of the intron 2 splice donor site. Because tissues showing abundant expression (kidney, liver, pancreas, gut, lung and gonads) are not easily accessible for analysis in living subjects, it has previously proven difficult to determine the effect of HNF-1 beta mutations at the mRNA level. This is the aim of the present study. We have developed a nested RT-PCR assay that exploits the presence of ectopic HNF-1 beta transcripts in Epstein-Barr virus (EBV)-transformed lymphoblastoid cell lines derived from subjects carrying HNF-1 beta splice site mutations. We report a fourth mutation of the intron 2 splice donor site, IVS2nt+2insT. Sequence analysis of ectopic HNF-1 beta transcripts showed that both IVS2nt+2insT and IVS2nt+1G&",2005-04-12,Diabetologia,Diabetologia,"Alternative Splicing; Base Sequence; DNA Primers; DNA-Binding Proteins; Diabetes Mellitus, Type 2; Female; Hepatocyte Nuclear Factor 1-beta; Humans; Kidney Diseases, Cystic; Male; Pedigree; RNA, Messenger; Transcription Factors; Transcription, Genetic",Harries,L W,2021-09-15
37,pub036,case_report,3,2021-11-01,11845237,10.1007/s001250200019,carbone2002.pdf,A novel hepatocyte nuclear factor-1beta (MODY-5) gene mutation in an Italian family with renal dysfunctions and early-onset diabetes.,NULL,2002-05-09,Diabetologia,Diabetologia,"Adult; Child; DNA-Binding Proteins; Diabetes Mellitus, Type 2; Female; Hepatocyte Nuclear Factor 1-beta; Humans; Italy; Kidney; Kidney Diseases; Kidney Failure, Chronic; Kidney Transplantation; Male; Pedigree; Transcription Factors",Carbone,I,2021-09-15
38,pub037,case_report,3,2021-11-01,21617276,NULL,banin2011.pdf,"A novel hepatocyte nuclear factor-1.. (MODY 5) gene mutation in a Romanian boy with pancreatic calcifications, renal and hepatic dysfunction.","We report a 12-years-old Romanian boy with a diagnosis of diabetes and renal insufficiency. Mutations in homeodomain-containing transcription factor hepatocyte nuclear factor (HNF-1..) have been reported in association with maturity-onset diabetes of the young (MODY 5) and early maturity-onset diabetes, progressive non-diabetic renal dysfunction and bilateral renal cysts. We found a new heterozygous mutation in HFN-1.. located in the exon 3 (c.715 G&gt;C; p.239R) associated to pancreatic calcifications. The importance of molecular diagnosis of MODY patients is reinforced and the need for a careful follow-up is stressed in order to monitor the progression of clinical manifestations and its correlation with the gene mutation.",2011-09-16,Georgian Med News,Georgian medical news,"Calcinosis; Child; Diabetes Mellitus; Hepatocyte Nuclear Factor 1-beta; Heterozygote; Humans; Italy; Kidney Diseases, Cystic; Liver Diseases; Male; Mutation; Pancreatic Diseases; Radiography; Renal Insufficiency; Syndrome",Banin,P,2021-09-15
39,pub038,case_series,3,2021-11-01,10672455,10.1007/s001250050018,weng2000.pdf,Hepatocyte nuclear factor-1 beta (MODY5) gene mutations in Scandinavian families with early-onset diabetes or kidney disease or both.,NULL,2000-03-02,Diabetologia,Diabetologia,"DNA Mutational Analysis; DNA-Binding Proteins; Diabetes Mellitus, Type 2; Diabetic Nephropathies; Exons; Genetic Variation; Hepatocyte Nuclear Factor 1-beta; Humans; Introns; Kidney Diseases; Mutation; Mutation, Missense; Point Mutation; Restriction Mapping; Scandinavian and Nordic Countries; Transcription Factors",Weng,J P,2021-09-15
40,pub039,research,3,2021-11-01,17267738,10.1681/ASN.2006091057,decramer2007.pdf,Anomalies of the TCF2 gene are the main cause of fetal bilateral hyperechogenic kidneys.,"Prenatal discovery of fetal bilateral hyperechogenic kidneys is very stressful for pregnant women and their family, and accurate diagnosis of the cause of the moderate forms of this pathology is very difficult. Hepatocyte nuclear factor-1beta that is encoded by the TCF2 gene is involved in the embryonic development of the kidneys. Sixty-two pregnancies with fetal bilateral hyperechogenic kidneys including 25 fetuses with inaccurate diagnosis were studied. TCF2 gene anomalies were detected in 18 (29%) of these 62 patients, and 15 of these 18 patients presented a complete heterozygous deletion of the TCF2 gene. Family screening revealed de novo TCF2 anomalies in more than half of the patients. TCF2 anomalies were associated with normal amniotic fluid volume and normal-sized kidneys between -2 and +2 SD in all patients except for two sisters. Antenatal cysts were detected in 11 of 18 patients, unilaterally in eight of 11. After birth, cysts appeared during the first year (17 of 18), and i",2007-07-24,J Am Soc Nephrol,Journal of the American Society of Nephrology : JASN,"Abortion, Eugenic; Female; Fetal Diseases; Gene Deletion; Glomerular Filtration Rate; Hepatocyte Nuclear Factor 1-beta; Humans; Infant, Newborn; Kidney Diseases, Cystic; Male; Oligohydramnios; Parents; Phenotype; Pregnancy; Ultrasonography, Prenatal",Decramer,St..phane,2021-09-15
41,pub040,case_series,3,2021-11-01,14583183,10.1016/S1056-8727(02)00221-0,so2003.pdf,Genetic variants of hepatocyte nuclear factor-1beta in Chinese young-onset diabetic patients with nephropathy.,"In Hong Kong, the prevalence of diabetes is estimated to be 2% in the young population. In the diabetic population, 30% of patients have diagnosis before the age of 40 years. Besides, 30% of young diabetic patients have varying degrees of albuminuria. Mutations in the gene encoding the hepatocyte nuclear factor (HNF)-1beta are associated with a subtype of maturity-onset diabetes of the young (MODY 5) characterized by urogenital abnormalities. We examined 74 unrelated Chinese subjects with young-onset diabetes complicated by nephropathy for variants in this gene. The HNF-1beta gene was screened by direct sequencing and the functional properties of wild-type and mutant proteins were analyzed by transactivation analysis.A novel variant in exon 3 (E260D) was found in one patient. Extended family analysis revealed four other siblings carrying this variant. One subject had diabetes and another had impaired glucose tolerance. Another sibling had microalbuminuria but normal glucose tolerance. ",2004-07-22,J Diabetes Complications,Journal of diabetes and its complications,"Adolescent; Adult; Albuminuria; Asian Continental Ancestry Group; DNA Mutational Analysis; DNA-Binding Proteins; Diabetes Mellitus, Type 2; Diabetic Nephropathies; Female; Genetic Predisposition to Disease; Genetic Variation; Genetics, Population; Hepatocyte Nuclear Factor 1-beta; Humans; Male; Transcription Factors",So,W Y,2021-09-15
42,pub041,case_report,3,2021-11-01,9703339,10.2337/diab.47.8.1354,nishigori1998.pdf,"Frameshift mutation, A263fsinsGG, in the hepatocyte nuclear factor-1beta gene associated with diabetes and renal dysfunction.",NULL,1998-09-09,Diabetes,Diabetes,"Adult; Aged; Child, Preschool; DNA-Binding Proteins; Diabetes Mellitus; Female; Frameshift Mutation; Hepatocyte Nuclear Factor 1; Hepatocyte Nuclear Factor 1-alpha; Hepatocyte Nuclear Factor 1-beta; Humans; Kidney Diseases; Kidney Failure, Chronic; Male; Nuclear Proteins; Pedigree; Polycystic Kidney Diseases; Transcription Factors; Ultrasonography, Prenatal",Nishigori,H,2021-09-15
43,pub042,case_report,3,2021-11-01,23926411,10.1297/cpe.21.53,wakako2003.pdf,A Case of Novel Mutation of HNF1B in Maturity-onset Diabetes of the Young Type 5 (MODY5).,NULL,2013-08-08,Clin Pediatr Endocrinol,Clinical pediatric endocrinology : case reports and clinical investigations : official journal of the Japanese Society for Pediatric Endocrinology,NULL,Jo,Wakako,2021-09-15
44,pub043,research,3,2021-11-01,19389850,10.1681/ASN.2008060633,adalat2009.pdf,HNF1B mutations associate with hypomagnesemia and renal magnesium wasting.,"Mutations in hepatocyte nuclear factor 1B (HNF1B), which is a transcription factor expressed in tissues including renal epithelia, associate with abnormal renal development. While studying renal phenotypes of children with HNF1B mutations, we identified a teenager who presented with tetany and hypomagnesemia. We retrospectively reviewed radiographic and laboratory data for all patients from a single center who had been screened for an HNF1B mutation. We found heterozygous mutations in 21 (23%) of 91 cases of renal malformation. All mutation carriers had abnormal fetal renal ultrasonography. Plasma magnesium levels were available for 66 patients with chronic kidney disease (stages 1 to 3). Striking, 44% (eight of 18) of mutation carriers had hypomagnesemia (&lt;1.58 mg/dl) compared with 2% (one of 48) of those without mutations (P &lt; 0.0001). The median plasma magnesium was significantly lower among mutation carriers than those without mutations (1.68 versus 2.02 mg/dl; P &lt; 0.0001)",2009-05-20,J Am Soc Nephrol,Journal of the American Society of Nephrology : JASN,Adolescent; Family; Female; Genetic Carrier Screening; Glomerular Filtration Rate; Hepatocyte Nuclear Factor 1-beta; Humans; Kidney; Magnesium; Magnesium Deficiency; Male; Mutation; Retrospective Studies; Ultrasonography; Wasting Syndrome,Adalat,Shazia,2021-09-15
45,pub044,research,3,2021-11-01,16971658,10.1681/ASN.2006030277,weber2006.pdf,Prevalence of mutations in renal developmental genes in children with renal hypodysplasia: results of the ESCAPE study.,"Renal hypodysplasia (RHD) is characterized by a reduced nephron number, small kidney size, and disorganized renal tissue. A hereditary basis has been established for a subset of affected patients, suggesting a major role of developmental genes that are involved in early kidney organogenesis. Gene mutations that have dominant inheritance and cause RHD, urinary tract anomalies, and defined extrarenal symptoms have been identified in TCF2 (renal cysts and diabetes syndrome), PAX2 (renal-coloboma syndrome), EYA1 and SIX1 (branchio-oto-renal syndrome), and SALL1 (Townes-Brocks syndrome). For estimation of the prevalence of these events, an unselected cohort of 99 unrelated patients with RHD that was associated with chronic renal insufficiency were screened for mutations in TCF2, PAX2, EYA1, SIX1, and SALL1. Mutations or variants in the genes of interest were detected in 17 (17%) unrelated families: One mutation, two variants, and four deletions of TCF2 in eight unrelated patients; four diff",2007-01-23,J Am Soc Nephrol,Journal of the American Society of Nephrology : JASN,Adolescent; Adult; Child; Female; Hepatocyte Nuclear Factor 1-beta; Homeodomain Proteins; Humans; Intracellular Signaling Peptides and Proteins; Male; Multicystic Dysplastic Kidney; Mutation; Nuclear Proteins; PAX2 Transcription Factor; Protein Tyrosine Phosphatases; Transcription Factors,Weber,Stefanie,2021-09-15
46,pub045,case_series,3,2021-11-01,24382792,10.1002/pd.4264,bodybechou2014.pdf,TCF2/HNF-1beta mutations: 3 cases of fetal severe pancreatic agenesis or hypoplasia and multicystic renal dysplasia.,"The aim of this study was to document the association between pancreatic agenesis or hypoplasia and multicystic renal dysplasia related to transcription factor 2 (TCF2) or hepatocyte nuclear factor 1 beta mutations. We describe the phenotype of the pancreas and the kidneys from three fetuses heterozygous for a mutation of TCF2. Case 1 had bilateral hyperechogenic, multicystic kidneys, bilateral clubfoot and pancreatic agenesis. Case 2 had two enlarged polycystic kidneys, anamnios and pancreatic agenesis. Case 3 had multicystic renal dysplasia, oligohydramnios and hypoplasia of the tail of the pancreas. TCF2 mutations are frequently discovered in fetuses presenting with bilateral hyperechogenic kidneys. The association between pancreatic agenesis and a TCF2 mutation has not previously been reported. TCF2 deficiency in mice leads to pancreatic agenesis, suggesting that the gene is essential for pancreatic development. Our observations indicate the importance of visualizing the pancreas d",2014-09-02,Prenat Diagn,Prenatal diagnosis,"Adult; Clubfoot; Female; Gestational Age; Hepatocyte Nuclear Factor 1-beta; Heterozygote; Humans; Multicystic Dysplastic Kidney; Mutation; Oligohydramnios; Pancreas; Phenotype; Pregnancy; Ultrasonography, Prenatal",Body-Bechou,Delphine,2021-09-15
47,pub046,case_report,3,2021-11-01,17878605,10.1507/endocrj.K07-051,fujimoto2007.pdf,In vitro and pathological investigations of MODY5 with the R276X-HNF1beta (TCF2) mutation.,"Maturity-onset diabetes of the young type 5 (MODY5) is caused by mutation of hepatocyte nuclear factor 1beta (HNF1 beta) (TCF2) gene, resulting in a wide range of phenotypes including diabetes and renal abnormalities, but little is known about the pathogenesis of the clinical spectrum. We describe a 27-year-old Japanese male with the MODY phenotype including an atrophic kidney and multiple renal cysts. Genetic analysis revealed the patient to be heterozygous for a nonsense mutation in codon 276 of the HNF1beta gene (CGA or Arginine to TGA or stop codon; R276X). To clarify the pathophysiological relevance of this mutation, we conducted an in vitro study monitoring human C-peptide secretion after transfecting both the HNF1beta mutant cDNA and preproinsulin cDNA into a murine beta cell line, MIN6. Functional studies of the transformed MIN6 cells indicated that expression of the R276X caused a significant decrease in glucose-stimulated insulin secretion but no change in either KCl-stimulat",2008-03-13,Endocr J,Endocrine journal,"Adult; Age of Onset; Arginine; C-Peptide; Cells, Cultured; Codon, Nonsense; Diabetes Mellitus, Type 2; Hepatocyte Nuclear Factor 1-beta; Humans; Insulin-Secreting Cells; Male; Pedigree; Polycystic Kidney Diseases; Transfection",Fujimoto,Kei,2021-09-15
48,pub047,research,3,2021-11-01,12161522,10.1210/jcem.87.8.8776,furuta2002.pdf,Nonsense and missense mutations in the human hepatocyte nuclear factor-1 beta gene (TCF2) and their relation to type 2 diabetes in Japanese.,"Mutations in transcription factors expressed in the pancreatic beta-cell are a major cause of maturity-onset diabetes of the young (MODY). They have also been found in patients diagnosed with type 1 and type 2 diabetes mellitus, which may highlight the difficulty in diagnosing these forms of diabetes or perhaps indicate a direct role in the development of multiple forms of diabetes. We have screened the hepatocyte nuclear factor-1 beta (HNF-1 beta/MODY5) gene for mutations in a group of 126 unrelated Japanese patients with type 2 diabetes and a family history of at least one first degree relative with diabetes. We identified one patient with a nonsense mutation (R276X) and another with a missense mutation (S465R). These mutations were present in the heterozygous state and were not found in 132 nondiabetic subjects (264 normal alleles). We identified a second patient with the S465R mutation on screening a second group of 272 randomly selected type 2 diabetic patients but not in another ",2002-08-30,J Clin Endocrinol Metab,The Journal of clinical endocrinology and metabolism,"Adolescent; Adult; Aged; Aged, 80 and over; Codon, Nonsense; DNA-Binding Proteins; Diabetes Mellitus, Type 2; Family Health; Female; Genetic Testing; Hepatocyte Nuclear Factor 1-beta; Humans; Japan; Male; Middle Aged; Mutation, Missense; Transcription Factors",Furuta,Hiroto,2021-09-15
49,pub048,case_report,3,2021-11-01,19346182,10.1016/j.nephro.2009.02.009,rigothier2009.pdf,[Phenotypic heterogeneity of TCF2's gene mutation coding for HNF-1 beta in a single family].,"TCF2 gene's mutation of autosomal dominant inheritance, encoding for the HNF-1 beta transcription factor, is associated with monogenic Mody5 diabetes, renal structural and urogenital abnormalities, and hepatic cholestasis. We have identified a family with HNF-1 beta gene's mutation, and very different phenotypic expression: renal abnormalities with cysts, nephrocalcinosis, polyuropolydipsic syndrome, Mody5 diabetes, genital malformations. Molecular analysis identified a mutation of exon 4 of the TCF2 gene. The coexistence in the same family of pleiomorphic renal malformations (cysts, renal agenesia or hypoplasia, renal failure) with Mody-type diabetes, with an autosomal inheritance must lead to the search for a mutation of TCF2, one of the most frequent genetic renal diseases.",2009-09-25,Nephrol Ther,Nephrologie &amp; therapeutique,"Abnormalities, Multiple; Adult; Diabetes Mellitus, Type 2; Exons; Female; Genetic Carrier Screening; Hepatocyte Nuclear Factor 1-beta; Humans; Infant, Newborn; Infant, Premature; Kidney; Male; Mutation; Pedigree; Phenotype",Rigothier,Claire,2021-09-15
50,pub049,NULL,3,2021-11-01,21775974,10.1038/ki.2011.225,faguer2011.pdf,"Diagnosis, management, and prognosis of HNF1B nephropathy in adulthood.","Mutations in HNF1B are responsible for a dominantly inherited disease with renal and nonrenal consequences, including maturity-onset diabetes of the young (MODY) type 5. While HNF1B nephropathy is typically responsible for bilateral renal cystic hypodysplasia in childhood, the adult phenotype is poorly described. To help define this we evaluated the clinical presentation, imaging findings, genetic changes, and disease progression in 27 adults from 20 families with HNF1B nephropathy. Whole-gene deletion was found in 11 families, point mutations in 9, and de novo mutations in half of the kindred tested. Renal involvement was extremely heterogeneous, with a tubulointerstitial profile at presentation and slowly progressive renal decline throughout adulthood as hallmarks of the disease. In 24 patients tested, there were cysts (...5 per kidney) in 15, a solitary kidney in 5, hypokalemia in 11, and hypomagnesemia in 10 of 16 tested, all as characteristics pointing to HNF1B disease. Two patien",2013-04-17,Kidney Int,Kidney international,"Adolescent; Adult; Aged; DNA Mutational Analysis; Diabetes Mellitus, Type 2; Diabetic Nephropathies; Disease Progression; Female; Gene Deletion; Hepatocyte Nuclear Factor 1-beta; Humans; Kidney Diseases; Male; Middle Aged; Mutation; Pedigree; Phenotype; Point Mutation; Prognosis; Young Adult",Faguer,Stanislas,2021-09-15
51,pub050,NULL,3,2021-11-01,24097065,10.1038/ng.2794,flannick2013.pdf,Assessing the phenotypic effects in the general population of rare variants in genes for a dominant Mendelian form of diabetes.,"Genome sequencing can identify individuals in the general population who harbor rare coding variants in genes for Mendelian disorders and who may consequently have increased disease risk. Previous studies of rare variants in phenotypically extreme individuals display ascertainment bias and may demonstrate inflated effect-size estimates. We sequenced seven genes for maturity-onset diabetes of the young (MODY) in well-phenotyped population samples (n = 4,003). We filtered rare variants according to two prediction criteria for disease-causing mutations: reported previously in MODY or satisfying stringent de novo thresholds (rare, conserved and protein damaging). Approximately 1.5% and 0.5% of randomly selected individuals from the Framingham and Jackson Heart Studies, respectively, carry variants from these two classes. However, the vast majority of carriers remain euglycemic through middle age. Accurate estimates of variant effect sizes from population-based sequencing are needed to avoi",2014-01-08,Nat Genet,Nature genetics,"Adult; Base Sequence; Basic Helix-Loop-Helix Transcription Factors; Chromosome Mapping; Diabetes Mellitus, Type 2; Female; Genetic Predisposition to Disease; Genetic Variation; Germinal Center Kinases; Hepatocyte Nuclear Factor 1-alpha; Hepatocyte Nuclear Factor 1-beta; Hepatocyte Nuclear Factor 4; Homeodomain Proteins; Humans; Male; Middle Aged; Phenotype; Protein-Serine-Threonine Kinases; Risk; Sequence Analysis, DNA; Trans-Activators; Young Adult",Flannick,Jason,2021-09-15
52,pub051,case_series,3,2021-11-01,10720943,10.1046/j.1523-1755.2000.057003898.x,bingham2000.pdf,Abnormal nephron development associated with a frameshift mutation in the transcription factor hepatocyte nuclear factor-1 beta.,"The transcription factor hepatocyte nuclear factor (HNF)-1 beta functions as a homodimer or as a heterodimer with the structurally related protein HNF-1 alpha. Both are expressed sequentially in rat kidney development, with HNF-1 beta being detected from the earliest inductory phases. HNF-1 beta gene mutations are associated with a unique disorder characterized by maturity-onset diabetes of the young (MODY) and early-onset and progressive nondiabetic renal dysfunction, which may lead to chronic renal failure. The HNF-1 beta gene was screened for mutations in six subjects with early-onset diabetes and a history of renal dysfunction in the subjects or their families. A novel frameshift mutation in exon 4 of the HNF-1 beta gene and a deletion of CCTCT at codons 328 to 329 were detected in one subject. She was diagnosed as diabetic at the age of 21 in her second pregnancy. Glucose tolerance rapidly deteriorated over 18 months as a result of beta-cell dysfunction. The HNF-1 beta mutation ar",2000-05-18,Kidney Int,Kidney international,"Abortion, Induced; Adult; Base Sequence; DNA-Binding Proteins; Diabetes Mellitus, Type 2; Female; Fetus; Frameshift Mutation; Gene Deletion; Hepatocyte Nuclear Factor 1-beta; Humans; Infant, Newborn; Insulin; Islets of Langerhans; Kidney Diseases; Male; Nephrons; Pedigree; Polycystic Kidney Diseases; Pregnancy; Transcription Factors; Ultrasonography, Prenatal",Bingham,C,2021-09-15
53,pub052,case_report,3,2021-11-01,12478351,10.1007/s00467-002-0975-2,mache2002.pdf,De novo HNF-1 beta gene mutation in familial hypoplastic glomerulocystic kidney disease.,"Mutations in the gene encoding the transcription factor hepatocyte nuclear factor (HNF)-1 beta are associated with maturity-onset diabetes of the young (type V), non-diabetic renal disease, and occasionally genital malformations in females. Recently, familial hypoplastic glomerulocystic kidney disease (GCKD) has been added to the clinical spectrum of HNF-1 beta gene mutations. Familial hypoplastic GCKD is a rare, dominantly inherited disorder characterized by small kidneys containing glomerular cysts, abnormal pelvicalyceal anatomy, and chronic renal failure. A family with hypoplastic GCKD occurring in the father and the daughter was screened for mutations in the HNF-1 beta gene. The sequence of exon 4 of the HNF-1 beta gene revealed a C insertion at codon 334 resulting in a frameshift mutation (P334fsinsC) in two family members. The P334fsinsC allele co-segregated with hypoplastic GCKD in the family. Oral glucose tolerance testing was normal in the 11-year-old girl. In her 38-year-old",2003-07-17,Pediatr Nephrol,"Pediatric nephrology (Berlin, Germany)","Austria; DNA; DNA-Binding Proteins; Female; Frameshift Mutation; Hepatocyte Nuclear Factor 1; Hepatocyte Nuclear Factor 1-alpha; Hepatocyte Nuclear Factor 1-beta; Humans; Infant; Kidney Diseases; Kidney Failure, Chronic; Kidney Glomerulus; Male; Nuclear Proteins; Pedigree; Reverse Transcriptase Polymerase Chain Reaction; Transcription Factors; Ultrasonography",Mache,Christoph J,2021-09-15
54,pub053,case_report,3,2021-11-01,17337496,10.2337/dc06-2618,karges2007.pdf,"Digenic inheritance of hepatocyte nuclear factor-1alpha and -1beta with maturity-onset diabetes of the young, polycystic thyroid, and urogenital malformations.",NULL,2007-06-13,Diabetes Care,Diabetes care,"Adolescent; Diabetes Mellitus, Type 2; Female; Genetic Carrier Screening; Hepatocyte Nuclear Factor 1; Hepatocyte Nuclear Factor 1-beta; Humans; Insulin; Insulin Secretion; Insulin-Secreting Cells; Male; Mutation; Pedigree; Sequence Deletion; Thyroid Diseases; Urogenital Abnormalities",Karges,Beate,2021-09-15
