publication_id,publication_alias,publication_type,publication_user_id,publication_entry_date,PMID,DOI,PDF,title,abstract,publication_date,journal_abbreviation,journal,keywords,firstauthor_lastname,firstauthor_firstname,update_date
1,our_report,case_series,3,2021-11-01,NULL,NULL,NULL,NULL,NULL,NULL,NULL,NULL,NULL,NULL,NULL,2021-09-15
2,pub001,research,3,2021-11-01,20378641,10.2215/CJN.06810909,heidet2010.pdf,Spectrum of HNF1B mutations in a large cohort of patients who harbor renal diseases.,"Hepatocyte nuclear factor 1beta (HNF1beta) is a transcription factor that is critical for the development of kidney and pancreas. In humans, mutations in HNF1B lead to congenital anomalies of the kidney and urinary tract, pancreas atrophy, and maturity-onset diabetes of the young type 5 and genital malformations. We report HNF1B screening in a cohort of 377 unrelated cases with various kidney phenotypes (hyperechogenic kidneys with size not more than +3 SD, multicystic kidney disease, renal agenesis, renal hypoplasia, cystic dysplasia, or hyperuricemic tubulointerstitial nephropathy not associated with UMOD mutation). We found a heterozygous mutation in 75 (19.9%) index cases, consisting of a deletion of the whole gene in 42, deletion of one exon in one, and small mutations in 32. Eighteen mutations were novel. De novo mutations accounted for 66% of deletions and 40% of small mutations. In patients who carried HNF1B mutation and for whom we were able to study prenatal ultrasonography (",2010-09-20,Clin J Am Soc Nephrol,Clinical journal of the American Society of Nephrology : CJASN,"Adolescent; Adult; Age Factors; Chi-Square Distribution; Child; Child, Preschool; Cohort Studies; DNA Mutational Analysis; Disease Progression; Exons; Female; Genetic Predisposition to Disease; Gestational Age; Glomerular Filtration Rate; Hepatocyte Nuclear Factor 1-beta; Humans; Infant, Newborn; Kidney; Kidney Diseases; Male; Mutation; Mutation, Missense; Phenotype; Retrospective Studies; Sequence Deletion; Severity of Illness Index; Ultrasonography, Prenatal",Heidet,Laurence,2021-09-15
3,pub002,case_series,3,2021-11-01,23979948,10.1210/jc.2012-3453,ferre2013.pdf,Early development of hyperparathyroidism due to loss of PTH transcriptional repression in patients with HNF1.. mutations?,"Heterozygous mutations or deletions of the transcription factor hepatocyte nuclear factor 1.. (HNF1..) result in a heterogeneous syndrome characterized by renal cysts and diabetes, together with a variety of other extrarenal and renal manifestations. Interestingly, in several patients with HNF1.. abnormalities, we observed early hyperparathyroidism and PTH levels that we judged inappropriately high compared with the degree of renal function decline. Based on the above clinical observations, we tested the hypothesis of a direct role of HNF1.. in the transcriptional regulation of the human PTH gene in the parathyroid gland. Immunostaining of human parathyroid sections, RT-PCR, chromatin immunoprecipitation (ChIP), and luciferase reporter assays in human embryonic kidney cells (HEK293) were performed. We eventually report clinical data from all 11 HNF1.. patients known at our institute, 9 with heterozygous HNF1.. whole-gene deletions and 2 with heterozygous HNF1.. mutations. PTH levels we",2013-12-10,J Clin Endocrinol Metab,The Journal of clinical endocrinology and metabolism,"Adolescent; Adult; Child; Female; Gene Expression Regulation; HEK293 Cells; Hepatocyte Nuclear Factor 1-beta; Humans; Hyperparathyroidism; Infant; Male; Middle Aged; Mutation; Parathyroid Glands; Parathyroid Hormone; Promoter Regions, Genetic; Transcription, Genetic",Ferr..,Silvia,2021-09-15
4,pub003,research,3,2021-11-01,16371430,10.1681/ASN.2005101040,ulinski2006.pdf,Renal phenotypes related to hepatocyte nuclear factor-1beta (TCF2) mutations in a pediatric cohort.,"The hepatocyte nuclear factor-1beta encoded by the TCF2 gene plays a role for the specific regulation of gene expression in various tissues such as liver, kidney, intestine, and pancreatic islets and is involved in the embryonic development of these organs. TCF2 mutations are known to be responsible for the maturity-onset diabetes of the young type 5 associated with renal manifestations. Several observations have suggested that TCF2 mutations may be involved in restricted renal phenotypes. Eighty children (median age at diagnosis 0.2 yr) with renal cysts, hyperechogenicity, hypoplasia, or single kidneys were studied. Quantitative multiplex PCR amplification of short fluorescence fragments for the search of large genomic rearrangements and sequencing for the detection of point mutations were performed. TCF2 anomalies were detected in one third of patients (25 of 80). The main alteration was the complete deletion of the TCF2 gene detected in 16 patients. Family screening revealed de novo",2006-06-22,J Am Soc Nephrol,Journal of the American Society of Nephrology : JASN,"Adolescent; Child; Child, Preschool; Cohort Studies; Female; Gene Deletion; Hepatocyte Nuclear Factor 1-beta; Humans; Infant; Kidney; Kidney Diseases, Cystic; Kidney Function Tests; Male; Phenotype; Point Mutation",Ulinski,Tim,2021-09-15
5,pub004,case_report,3,2021-11-01,25705165,10.5808/GI.2014.12.4.240,kim2014.pdf,Identification and Functional Characterization of P159L Mutation in HNF1B in a Family with Maturity-Onset Diabetes of the Young 5 (MODY5).,"Mutation in HNF1B, the hepatocyte nuclear factor-1.. (HNF-1..) gene, results in maturity-onset diabetes of the young (MODY) 5, which is characterized by gradual impairment of insulin secretion. However, the functional role of HNF-1.. in insulin secretion and glucose metabolism is not fully understood. We identified a family with early-onset diabetes that fulfilled the criteria of MODY. Sanger sequencing revealed that a heterozygous P159L (CCT to CTT in codon 159 in the DNA-binding domain) mutation in HNF1B was segregated according to the affected status. To investigate the functional consequences of this HNF1B mutation, we generated a P159L HNF1B construct. The wild-type and mutant HNF1B constructs were transfected into COS-7 cells in the presence of the promoter sequence of human glucose transporter type 2 (GLUT2). The luciferase reporter assay revealed that P159L HNF1B had decreased transcriptional activity compared to wild-type (p &lt; 0.05). Electrophoretic mobility shift assay sho",2015-02-23,Genomics Inform,Genomics &amp; informatics,glucose transporter type 2; hepatocyte nuclear factor-1..; point mutation; type 2 diabetes mellitus,Kim,Eun Ky,2021-09-15
6,pub005,case_series,3,2021-11-01,16249435,10.2337/diabetes.54.11.3126,bellannechantelot2005.pdf,Large genomic rearrangements in the hepatocyte nuclear factor-1beta (TCF2) gene are the most frequent cause of maturity-onset diabetes of the young type 5.,"Maturity-onset diabetes of the young (MODY) 5 is caused by mutations in the TCF2 gene encoding the transcription factor hepatocyte nuclear factor-1beta. However, in 60% of the patients with a phenotype suggesting MODY5, no point mutation is detected in TCF2. We have hypothesized that large genomic rearrangements of TCF2 that are missed by conventional screening methods may account for this observation. In 40 unrelated patients presenting with MODY5 phenotype, TCF2 was screened for mutations by sequencing. Patients without mutations were then screened for TCF2 rearrangements by the quantitative multiplex PCR of short fluorescent fragments (QMPSF). Among the 40 patients, the overall detection rate was 70%: 18 had point mutations, 9 had whole-gene deletions, and 1 had a deletion of a single exon. Similar phenotypes were observed in patients with mutations and in subjects with large deletions. These results suggest that MODY5 is more prevalent than previously reported, with one-third of th",2006-01-20,Diabetes,Diabetes,"Adolescent; Adult; Aged; Alleles; Base Sequence; Chromosome Mapping; Diabetes Mellitus, Type 2; Female; Hepatocyte Nuclear Factor 1-beta; Humans; Male; Middle Aged; Molecular Sequence Data; Mutation; Phenotype",Bellann..-Chantelot,Christine,2021-09-15
7,pub006,case_series,3,2021-11-01,15930087,10.1136/jmg.2005.032854,edghill2005.pdf,Mutations in hepatocyte nuclear factor-1beta and their related phenotypes.,"Hepatocyte nuclear factor-1 beta (HNF-1beta) is a widely distributed transcription factor which plays a critical role in embryonic development of the kidney, pancreas, liver, and Mullerian duct. Thirty HNF-1beta mutations have been reported in patients with renal cysts and other renal developmental disorders, young-onset diabetes, pancreatic atrophy, abnormal liver function tests, and genital tract abnormalities. We sequenced the HNF-1beta gene in 160 unrelated subjects with renal disease, 40% of whom had a personal/family history of diabetes. Twenty three different heterozygous HNF-1beta mutations were identified in 23/160 subjects (14%), including 10 novel mutations (V61G, V110G, S148L, K156E, Q176X, R276Q, S281fsinsC, R295P, H324fsdelCA, Q470X). Seven (30%) cases were proven to be due to de novo mutations. Renal cysts were found in 19/23 (83%) patients (four with glomerulocystic kidney disease, GCKD) and diabetes in 11/23 (48%, while three other families had a family history of diab",2006-12-15,J Med Genet,Journal of medical genetics,"Adolescent; Adult; Child; Child, Preschool; Exons; Hepatocyte Nuclear Factor 1-beta; Humans; Infant; Kidney Diseases; Mutation; Pedigree; Phenotype",Edghill,E L,2021-09-15
8,pub007,case_report,3,2021-11-01,18065799,10.1093/ndt/gfm685,hoskins2007.pdf,Missense mutations in EYA1 and TCF2 are a rare cause of urinary tract malformations.,NULL,2008-07-15,Nephrol Dial Transplant,"Nephrology, dialysis, transplantation : official publication of the European Dialysis and Transplant Association - European Renal Association","Adolescent; Adult; Aged; Child; Child, Preschool; Female; Hepatocyte Nuclear Factor 1-beta; Humans; Intracellular Signaling Peptides and Proteins; Male; Middle Aged; Mutation, Missense; Nuclear Proteins; Protein Tyrosine Phosphatases; Urinary Tract",Hoskins,Bethan E,2021-09-15
9,pub008,case_report,3,2021-11-01,12460054,10.1053/ajkd.2002.36915,waller2002.pdf,Severe hyperglycemia after renal transplantation in a pediatric patient with a mutation of the hepatocyte nuclear factor-1beta gene.,"After renal transplantation for congenital cystic kidney disease of unknown origin, a 14-year-old boy, who was previously normoglycemic, had ""steroid-induced"" diabetes mellitus, which was treated with insulin. Transplant failure from chronic rejection and subsequent transplant nephrectomy allowed discontinuation of corticosteroids, the gradual withdrawal of insulin and normoglycemia. The recent description of renal cysts and diabetes (RCAD) syndrome and a strong paternal family history of early-onset diabetes mellitus prompted genetic screening of the hepatocyte nuclear factor-1beta gene. A novel heterozygous frameshift mutation in exon 1 was identified, adding to the 12 kindreds thus far described. This case highlights the unmasking of the hyperglycemic component of the RCAD syndrome in the immediate postoperative period after renal transplantation and emphasizes the pleiotropic manifestations of this important genetic kidney disease.",2002-12-20,Am J Kidney Dis,American journal of kidney diseases : the official journal of the National Kidney Foundation,Adolescent; Cysts; DNA; DNA Mutational Analysis; DNA-Binding Proteins; Diabetes Mellitus; Exons; Frameshift Mutation; Genetic Carrier Screening; Hepatocyte Nuclear Factor 1-beta; Humans; Hyperglycemia; Kidney Diseases; Kidney Transplantation; Leukocytes; Male; Prenatal Diagnosis; Syndrome; Transcription Factors; Ultrasonography,Waller,Simon C,2021-09-15
10,pub009,case_report,3,2021-11-01,15168014,10.1007/s00125-004-1402-y,shihara2004.pdf,Identification of a new case of hepatocyte nuclear factor-1beta mutation with highly varied phenotypes.,NULL,2005-02-15,Diabetologia,Diabetologia,"Adolescent; Case-Control Studies; Chronic Disease; DNA-Binding Proteins; Diabetes Mellitus, Type 2; Female; Genetic Predisposition to Disease; Hepatocyte Nuclear Factor 1-beta; Humans; Japan; Kidney; Kidney Diseases; Kidney Transplantation; Mutation; Phenotype; Transcription Factors; Uterus",Shihara,N,2021-09-15
11,pub010,case_series,3,2021-11-01,11085914,10.1086/316945,bingham2001.pdf,Mutations in the hepatocyte nuclear factor-1beta gene are associated with familial hypoplastic glomerulocystic kidney disease.,Familial glomerulocystic kidney disease (GCKD) is a dominantly inherited condition characterized by glomerular cysts and variable renal size and function; the molecular genetic etiology is unknown. Mutations in the gene encoding hepatocyte nuclear factor (HNF)-1beta have been associated with early-onset diabetes and nondiabetic renal disease-particularly renal cystic disease. We investigated a possible role for the HNF-1beta gene in four unrelated GCKD families and identified mutations in two families: a nonsense mutation in exon 1 (E101X) and a frameshift mutation in exon 2 (P159fsdelT). The family members with HNF-1beta gene mutations had hypoplastic GCKD and early-onset diabetes or impaired glucose tolerance. We conclude that there is genetic heterogeneity in familial GCKD and that the hypoplastic subtype is a part of the clinical spectrum of the renal cysts and diabetes syndrome that is associated with HNF-1beta mutations.,2001-02-15,Am J Hum Genet,American journal of human genetics,"Adolescent; Adult; Age of Onset; Blood Pressure; Child; Codon, Nonsense; Creatine; DNA Mutational Analysis; DNA-Binding Proteins; Diabetes Complications; Diabetes Mellitus; Exons; Female; Frameshift Mutation; Genetic Heterogeneity; Glucose Intolerance; Hepatocyte Nuclear Factor 1-beta; Humans; Infant; Infant, Newborn; Kidney Diseases, Cystic; Male; Middle Aged; Mutation; Pedigree; Syndrome; Transcription Factors",Bingham,C,2021-09-15
12,pub011,case_series,3,2021-11-01,16801329,10.1093/hmg/ddl161,haumaitre2006.pdf,Severe pancreas hypoplasia and multicystic renal dysplasia in two human fetuses carrying novel HNF1beta/MODY5 mutations.,"Heterozygous mutations in the HNF1beta/vHNF1/TCF2 gene cause maturity-onset diabetes of the young (MODY5), associated with severe renal disease and abnormal genital tract. Here, we characterize two fetuses, a 27-week male and a 31.5-week female, carrying novel mutations in exons 2 and 7 of HNF1beta, respectively. Although these mutations were predicted to have different functional consequences, both fetuses displayed highly similar phenotypes. They presented one of the most severe phenotypes described in HNF1beta carriers: bilateral enlarged polycystic kidneys, severe pancreas hypoplasia and abnormal genital tract. Consistent with this, we detected high levels of HNF1beta transcripts in 8-week human embryos in the mesonephros and metanephric kidney and in the epithelium of pancreas. Renal histology and immunohistochemistry analyses of mutant fetuses revealed cysts derived from all nephron segments with multilayered epithelia and dysplastic regions, accompanied by a marked increase in t",2006-10-17,Hum Mol Genet,Human molecular genetics,"Aborted Fetus; Adult; Diabetes Mellitus, Type 2; Epithelium; Female; Fetal Diseases; Frameshift Mutation; Gene Dosage; Hepatocyte Nuclear Factor 1-beta; Humans; Immunohistochemistry; Kidney; Male; Multicystic Dysplastic Kidney; Pancreas; Pregnancy",Haumaitre,C..cile,2021-09-15
13,pub012,case_series,3,2021-11-01,15068978,10.7326/0003-4819-140-7-200404060-00009,bellannechantelot2004.pdf,Clinical spectrum associated with hepatocyte nuclear factor-1beta mutations.,"Maturity-onset diabetes of the young type 5 (MODY5), a type of dominantly inherited diabetes mellitus and nephropathy, has been associated with mutations of the hepatocyte nuclear factor-1beta (HNF-1beta) gene, mostly generating truncated protein. Various phenotypes, including urogenital malformations, are related to HNF-1beta mutations. To describe clinical and genetic findings in 13 patients with 8 novel HNF-1beta mutations. Multicenter, descriptive study. 2 departments of diabetes, 1 department of internal medicine, and 1 department of nephrology. 8 probands with diabetes diagnosed before 40 years of age and nondiabetic kidney disease who were selected independent of their family history of diabetes, and 5 offspring. Characteristics of diabetes, renal function and structure, genital tract abnormalities, pancreas structure, insulin secretion, exocrine pancreas function, and liver test results. All mutations, including 5 missense changes, were found in the DNA-binding domain. Cosegreg",2004-04-20,Ann Intern Med,Annals of internal medicine,"Adult; Atrophy; DNA-Binding Proteins; Diabetes Mellitus, Type 2; Diabetic Nephropathies; Exocrine Pancreatic Insufficiency; Genes, Dominant; Genitalia; Hepatocyte Nuclear Factor 1; Hepatocyte Nuclear Factor 1-alpha; Hepatocyte Nuclear Factor 1-beta; Humans; Kidney; Mutation; Nuclear Proteins; Pancreas; Phenotype; Transcription Factors",Bellann..-Chantelot,Christine,2021-09-15
14,pub013,case_report,3,2021-11-01,20543213,10.1093/ndt/gfq315,giglio2010.pdf,Growth hormone therapy-related hyperglycaemia in a boy with renal cystic hypodysplasia and a new mutation of the HNF1 beta gene.,"We provide a molecular and pathophysiological characterization of an 11-year-old male patient, with a diagnosis of renal hypodysplasia, cysts and chronic renal failure. Although previously normoglycaemic and with a negative familial history for diabetes mellitus, he developed fasting hyperglycaemia within 12 months of the start of treatment with recombinant human growth hormone (rhGH). Direct sequencing of the HNF1 beta gene revealed a de novo heterozygous mutation in exon 2, c.535delC [Pro118LeuX7]+[=]. The appearance of fasting hyperglycaemia following rhGH treatment in children with renal cystic hypodysplasia suggests that investigation of the HNF1 beta gene is warranted, even when familial history is negative for diabetes. This is particularly important in regard to genetic counselling.",2010-12-23,Nephrol Dial Transplant,"Nephrology, dialysis, transplantation : official publication of the European Dialysis and Transplant Association - European Renal Association","Child; Hepatocyte Nuclear Factor 1-beta; Human Growth Hormone; Humans; Hyperglycemia; Kidney Diseases, Cystic; Kidney Failure, Chronic; Male; Mutation; Prognosis; Recombinant Proteins",Giglio,Sabrina,2021-09-15
15,pub014,case_series,3,2021-11-01,22432796,10.1111/j.1432-2277.2012.01458.x,poitou2012.pdf,Maturity onset diabetes of the young: clinical characteristics and outcome after kidney and pancreas transplantation in MODY3 and RCAD patients: a single center experience.,"The diabetes and renal phenotype of patients with maturity-onset diabetes of the young (MODY) on a transplantation waiting list is not known; neither is their outcome after pancreas (PT) and/or kidney transplantation (KT). Between 2002 and 2009, we screened 50 of 150 patients referred for kidney and pancreas transplantation to the Kremlin-Bic..tre center for HNF1B and HNF1A mutations if one or more of the following criteria was present (i) an atypical history of diabetes (ii) diabetes with at least one affected parent or two affected relatives, (iii) an absence of auto-antibodies at diagnosis (iv) a persistent secretion of fasting C peptide (v) a personal or a family history of renal cysts or dysplasia. Their phenotype and their outcome were analyzed. Four HNF1A (MODY3) and eight HNF1B mutations [renal cysts and diabetes (RCAD)] were identified. All MODY3 patients had diabetic nephropathy, but only 50% of RCAD patients. Four patients underwent a kidney and pancreas transplantation and ",2012-08-02,Transpl Int,Transplant international : official journal of the European Society for Organ Transplantation,"Adult; Central Nervous System Diseases; Cohort Studies; Dental Enamel; Diabetes Mellitus, Type 2; Female; Follow-Up Studies; Graft Survival; Hepatocyte Nuclear Factor 1-alpha; Hepatocyte Nuclear Factor 1-beta; Humans; Islets of Langerhans Transplantation; Kidney Diseases, Cystic; Kidney Transplantation; Male; Middle Aged; Mutation; Survival Analysis",Poitou,Caroline,2021-09-15
16,pub015,research,3,2021-11-01,22060211,10.1111/j.1399-5448.2011.00827.x,yorifuji2011.pdf,Comprehensive molecular analysis of Japanese patients with pediatric-onset MODY-type diabetes mellitus.,"In Asians, mutations in the known maturity-onset diabetes of the young (MODY) genes have been identified in only &lt;15% of patients. These results were obtained mostly through studies on adult patients. To investigate the molecular basis of Japanese patients with pediatric-onset MODY-type diabetes. Eighty Japanese patients with pediatric-onset MODY-type diabetes. Mitochondrial 3243A&gt;G mutation was first tested by the polymerase chain reaction restriction fragment length polymorphism analysis for maternally inherited families. Then, all coding exons and exon-intron boundaries of the HNF1A, HNF1B, GCK, and HNF4A genes were amplified from genomic DNA and directly sequenced. Multiplex ligation-dependent probe amplification analysis was also performed to detect whole-exon deletions. After excluding one patient with a mitochondrial 3243A&gt;G, mutations were identified in 38 (48.1%) patients; 18 had GCK mutations, 11 had HNF1A mutations, 3 had HNF4A mutations, and 6 had HNF1B mutations. ",2012-06-01,Pediatr Diabetes,Pediatric diabetes,"Adolescent; Age of Onset; Asian Continental Ancestry Group; Child; Child, Preschool; DNA Mutational Analysis; DNA, Mitochondrial; Diabetes Mellitus, Type 2; Female; Gene Frequency; Glucokinase; Hepatocyte Nuclear Factor 1-alpha; Hepatocyte Nuclear Factor 1-beta; Hepatocyte Nuclear Factor 4; Humans; Infant; Male",Yorifuji,Tohru,2021-09-15
17,pub016,screening_multiple,3,2021-11-01,23520208,10.1681/ASN.2012010097,vivante2013.pdf,Renal hypodysplasia associates with a WNT4 variant that causes aberrant canonical WNT signaling.,"Abnormal differentiation of the renal stem/progenitor pool into kidney tissue can lead to renal hypodysplasia (RHD), but the underlying causes of RHD are not well understood. In this multicenter study, we identified 20 Israeli pedigrees with isolated familial, nonsyndromic RHD and screened for mutations in candidate genes involved in kidney development, including PAX2, HNF1B, EYA1, SIX1, SIX2, SALL1, GDNF, WNT4, and WT1. In addition to previously reported RHD-causing genes, we found that two affected brothers were heterozygous for a missense variant in the WNT4 gene. Functional analysis of this variant revealed both antagonistic and agonistic canonical WNT stimuli, dependent on cell type. In HEK293 cells, WNT4 inhibited WNT3A induced canonical activation, and the WNT4 variant significantly enhanced this inhibition of the canonical WNT pathway. In contrast, in primary cultures of human fetal kidney cells, which maintain WNT activation and more closely represent WNT signaling in renal pr",2013-06-06,J Am Soc Nephrol,Journal of the American Society of Nephrology : JASN,"Adolescent; Cell Differentiation; Child; Child, Preschool; Female; HEK293 Cells; Humans; Infant; Israel; Kidney Diseases; Male; Mutation; PAX2 Transcription Factor; Sequence Analysis, DNA; Wnt Signaling Pathway; Wnt4 Protein; Young Adult",Vivante,Asaf,2021-09-15
18,pub017,research,3,2021-11-01,10484768,10.1093/hmg/8.11.2001,lindner1999.pdf,"A novel syndrome of diabetes mellitus, renal dysfunction and genital malformation associated with a partial deletion of the pseudo-POU domain of hepatocyte nuclear factor-1beta.","Mutations in the homeodomain-containing transcription factor hepatocyte nuclear factor (HNF)-1beta are the cause of one form of maturity-onset diabetes of the young (MODY), type 5 (MODY5). We have studied a Norwegian family, N5, with a syndrome of mild diabetes, progressive non-diabetic renal disease and severe genital malformations. The sequence of the HNF-1beta gene ( TCF2 ) revealed a 75 bp deletion in exon 2 (409-483del) which would result in the synthesis of a protein lacking amino acids Arg137 to Lys161 (R137-K161del). This deletion is located in the pseudo-POU region of HNF-1beta, a region implicated in the specificity of DNA binding. Functional studies of R137-K161del HNF-1beta revealed that it could not bind an HNF-1 target sequence or stimulate transcription of a reporter gene indicating that this is a loss-of-function mutation. The R137-K161del allele co-segregated with diabetes and renal disease in pedigree N5. In addition, two of four female carriers with this mutation had",1999-12-16,Hum Mol Genet,Human molecular genetics,"Adolescent; Adult; Child; DNA; DNA-Binding Proteins; Diabetes Mellitus, Type 2; Diabetes, Gestational; Female; Frameshift Mutation; Genitalia; HeLa Cells; Hepatocyte Nuclear Factor 1-beta; Humans; Kidney Diseases; Kidney Diseases, Cystic; Male; Middle Aged; Point Mutation; Pregnancy; Protein Structure, Tertiary; RNA Splicing; Recombinant Fusion Proteins; Sequence Deletion; Syndrome; Transcription Factors; Transfection; Vagina",Lindner,T H,2021-09-15
